{"schema_version":"case/1","case_id":"case-pilot-mentiva","kind":"null","as_of":"2026-10-20","profile_path":"research/bench/pilot/profiles/prof-pilot-mentiva.json","profile_sha256":"e09a1686242c31f37bccee12b126da1d2a9b1af52082d4fe2230c675de514898","construction":{"curator":"pilot-only","profile_builder":"code:briefToProfile@v1","profile_builder_saw_anchor":false,"selection_order":"profile_first","profile_source_kind":"real_org_internal_docs"},"anchor":null,"null_case":{"rationale":"Pilot integration case without a required known anchor; it is excluded from the benchmark.","manual_search_minutes":20,"manual_queries":["digital mental health grant 2026","wellbeing technology open call 2026","mental health innovation challenge 2026"]}}
