{"schema_version":"case/1","case_id":"case-pilot-aha","kind":"null","as_of":"2026-10-20","profile_path":"research/bench/pilot/profiles/prof-pilot-aha.json","profile_sha256":"9f1361637cd0e6ca29eaaef57fb228cb30439b5c1773f8dc1ba0983a15af3463","construction":{"curator":"pilot-only","profile_builder":"code:briefToProfile@v1","profile_builder_saw_anchor":false,"selection_order":"profile_first","profile_source_kind":"real_org_internal_docs"},"anchor":null,"null_case":{"rationale":"Pilot integration case without a required known anchor; it is excluded from the benchmark.","manual_search_minutes":20,"manual_queries":["Alzheimer data infrastructure grant 2026","open science harmonization funding 2026","Alzheimer research challenge 2026"]}}
